{
  "artifact": "HERMES_FOREGROUND_RUN_RECEIPT",
  "schema_version": 1,
  "generated_at": "2026-06-01T11:36:43Z",
  "status": "success",
  "reason": "ok",
  "command": {
    "argv": [
      "/Users/briancl/repos/hermes-agent/.venv-bma-sidecar/bin/hermes",
      "chat",
      "--provider",
      "copilot",
      "-m",
      "gpt-5.5",
      "-q",
      "Reply exactly HERMES_FOREGROUND_LAUNCHER_SMOKE_OK. Do not edit files. Do not run tools.",
      "--max-turns",
      "40",
      "-Q"
    ],
    "cwd": "/Users/briancl/repos/build-meta-analysis",
    "provider": "copilot",
    "model": "gpt-5.5",
    "max_turns": 40,
    "timeout_seconds": 180
  },
  "prompt": {
    "source": "inline",
    "sha256": "89450944c3f7b07ee7f8e91f61ab7bfa1dc605d227d2f8c6ee565919100285b7",
    "retained_path": "/private/tmp/bma-issue396-hermes-launcher-smoke/hermes-prompt.txt"
  },
  "stdout_path": "/private/tmp/bma-issue396-hermes-launcher-smoke/hermes-stdout.txt",
  "stderr_path": "/private/tmp/bma-issue396-hermes-launcher-smoke/hermes-stderr.txt",
  "return_code": 0,
  "validation": {
    "passed": true,
    "final_response_lines": 1,
    "error": null
  },
  "bounded_non_claims": [
    "does not retry or loop",
    "does not create or update GitHub issues automatically",
    "does not schedule background work",
    "does not mutate Hermes internals",
    "does not transfer campaign ownership to Hermes"
  ]
}
